{
  "$schema": "https://json-schema.org/draft/2020-12/schema",
  "$id": "https://raw.githubusercontent.com/ymtzsbj/llm-workflow-engine/main/schema/workflow.schema.json",
  "title": "LLM Workflow Engine Workflow",
  "description": "A local-first workflow definition for llm-workflow-engine.",
  "type": "object",
  "additionalProperties": false,
  "required": [
    "version",
    "name",
    "steps"
  ],
  "properties": {
    "$schema": {
      "type": "string",
      "format": "uri-reference"
    },
    "version": {
      "const": "1"
    },
    "name": {
      "type": "string",
      "minLength": 1
    },
    "description": {
      "type": "string"
    },
    "inputs": {
      "type": "object"
    },
    "steps": {
      "type": "array",
      "minItems": 1,
      "items": {
        "$ref": "#/$defs/step"
      }
    }
  },
  "$defs": {
    "step": {
      "type": "object",
      "additionalProperties": false,
      "required": [
        "id",
        "uses"
      ],
      "properties": {
        "id": {
          "type": "string",
          "pattern": "^[A-Za-z0-9_-]+$"
        },
        "uses": {
          "enum": [
            "read_text",
            "render_template",
            "write_text"
          ]
        },
        "with": {
          "type": "object"
        },
        "needs": {
          "type": "array",
          "items": {
            "type": "string"
          },
          "uniqueItems": true
        },
        "approval": {
          "const": "required"
        }
      }
    }
  }
}
